{
  "version": "dgp-8-alpha",
  "start_nodes": ["docs/ai/README.md","docs/ai/ordivon-root-context.md","docs/ai/current-phase-boundaries.md"],
  "required_nodes": [
    "docs/ai/new-ai-collaborator-guide.md","docs/ai/agent-working-rules.md",
    "docs/ai/agent-output-contract.md","docs/governance/current-truth-entry-map.jsonl",
    "docs/ai/onboarding-protocol-dgp-4.md","docs/ai/no-go-boundary-map.md"
  ],
  "optional_nodes": [
    "docs/governance/document-authority-model-dgp-3.md",
    "docs/governance/document-lifecycle-governance-dgp-2.md",
    "docs/ai/architecture-file-map.md"
  ],
  "forbidden_as_current_truth_nodes": [],
  "archive_warning_nodes": [],
  "generated_view_nodes": ["registry-index output"],
  "max_initial_reading_set": 12,
  "expansion_rules": "Follow references in onboarding protocol for deep context."
}
